{"category":"demo_disposals_season","coverage_note":"DEMO: rows with missing statistics show \"not recorded\" coverage.","era":"all","method":"DEMO: sum of recorded values","method_version":"demo-1","rows":[{"clubs":["Demo Club A"],"coverage":1,"eligible_games":8,"name":"Demo Player A1","observed_games":8,"player_id":"legacy:demo_player_a1","rank":1,"seasons":"2025–2026","value":100,"value_label":"DEMO season disposals"},{"clubs":["Demo Club B"],"coverage":1,"eligible_games":8,"name":"Demo Player B1","observed_games":8,"player_id":"legacy:demo_player_b1","rank":2,"seasons":"2026–2026","value":90,"value_label":"DEMO season disposals"},{"clubs":["Demo Club A","Demo Club C"],"coverage":1,"eligible_games":8,"name":"Demo Same Name","observed_games":8,"player_id":"legacy:demo_same_name_2020","rank":3,"seasons":"2025–2026","value":80,"value_label":"DEMO season disposals"},{"clubs":["Demo Club Old (historical)"],"coverage":0.5,"eligible_games":8,"name":"Demo Same Name","observed_games":8,"player_id":"legacy:demo_same_name_1990","rank":4,"seasons":"1994–1994","value":70,"value_label":"DEMO season disposals"},{"clubs":["Demo Club C"],"coverage":1,"eligible_games":8,"name":"Demo Zoë Ärger","observed_games":8,"player_id":"legacy:demo_zoe_arger","rank":5,"seasons":"2026–2026","value":60,"value_label":"DEMO season disposals"},{"clubs":["Demo Club Old (historical)"],"coverage":null,"eligible_games":8,"name":"Demo Player Sparse","observed_games":null,"player_id":"legacy:demo_player_sparse","rank":6,"seasons":"1994–1994","value":50,"value_label":"DEMO season disposals"}],"scope":"single_season","title":"DEMO single-season disposals","warning":null}
