{"category":"demo_disposals_career","coverage_note":"DEMO: rows with missing statistics show \"not recorded\" coverage.","era":"1990s","method":"DEMO: sum of recorded values","method_version":"demo-1","rows":[{"clubs":["Demo Club Old (historical)"],"coverage":0.5,"eligible_games":8,"name":"Demo Same Name","observed_games":8,"player_id":"legacy:demo_same_name_1990","rank":1,"seasons":"1994–1994","value":70,"value_label":"DEMO career disposals"},{"clubs":["Demo Club Old (historical)"],"coverage":null,"eligible_games":8,"name":"Demo Player Sparse","observed_games":null,"player_id":"legacy:demo_player_sparse","rank":2,"seasons":"1994–1994","value":50,"value_label":"DEMO career disposals"}],"scope":"career","title":"DEMO career disposals","warning":"DEMO historical-methodology warning: early-era statistics are incomplete."}
